[
  {
    "alternative_request_ref": null,
    "alternative_result_ref": null,
    "baseline_request_ref": "tsd-request-0123456789abcdef",
    "changed_fields": [],
    "check_family": "exact_rerun",
    "check_id": "ra-check-93904c8f1da58963089e6bd0364f92b8",
    "check_result_id": "ra-check-result-aefe133ab8ab219aa743072ab64e9e29",
    "evidence_refs": [
      "alternative-bundles/exact-rerun"
    ],
    "execution_error": null,
    "input_checksums": {},
    "metrics": {
      "canonical_result_equality": true
    },
    "output_checksums": {},
    "required": true,
    "rule_results": [
      {
        "observed": true,
        "passed": true,
        "rule_id": "exact_match_required"
      }
    ],
    "same_estimand": true,
    "schema_version": "0.1.0",
    "status": "passed",
    "threat_refs": [],
    "threat_updates": [],
    "warnings": []
  },
  {
    "alternative_request_ref": null,
    "alternative_result_ref": null,
    "baseline_request_ref": "tsd-request-0123456789abcdef",
    "changed_fields": [
      "lags"
    ],
    "check_family": "lag_sensitivity",
    "check_id": "ra-check-4381c1fabc0180978aec15efc6c64e44",
    "check_result_id": "ra-check-result-fa25feef556401371c628a99603372b2",
    "evidence_refs": [
      "tsd-result-794adcbf79010a758e3d8e0d2438062f",
      "tsd-result-8a312b5f9cbaf18fc94fca5b1b05eb09"
    ],
    "execution_error": null,
    "input_checksums": {},
    "metrics": {
      "alternatives": [
        {
          "absolute_estimate_delta": [
            0.017111103745379476,
            0.025949040744359858,
            0.02098110696449096,
            0.005633806807000319,
            4.283814955274856e-05,
            0.007350231436092813,
            0.013784825622676522,
            0.021279770175534396,
            0.011696851888694848,
            0.021461381728824613,
            0.01357740278003794,
            0.028361995802638873,
            0.025623201618863112,
            0.009694083280831878,
            0.033339843713515505,
            0.048840187782030586,
            0.061553313817111155,
            0.08226102994202211
          ],
          "alternative_id": "ra-alt-ed5c2aa2a14eddfa516c629020579ddc",
          "anchor_sign_changes": 0,
          "estimate_delta": [
            0.017111103745379476,
            0.025949040744359858,
            0.02098110696449096,
            0.005633806807000319,
            4.283814955274856e-05,
            -0.007350231436092813,
            -0.013784825622676522,
            -0.021279770175534396,
            -0.011696851888694848,
            -0.021461381728824613,
            -0.01357740278003794,
            -0.028361995802638873,
            -0.025623201618863112,
            -0.009694083280831878,
            -0.033339843713515505,
            -0.048840187782030586,
            -0.061553313817111155,
            -0.08226102994202211
          ],
          "horizons": [
            0,
            1,
            2,
            3,
            4,
            5,
            6,
            7,
            8,
            9,
            10,
            11,
            12,
            13,
            14,
            15,
            16,
            17
          ],
          "interval_overlap": [
            true,
            true,
            true,
            true,
            true,
            true,
            true,
            true,
            true,
            true,
            true,
            true,
            true,
            true,
            true,
            true,
            true,
            true
          ],
          "max_coefficient_delta": 0.08226102994202211,
          "max_standardized_path_deviation": 0.2505845711076618,
          "nobs_delta": [
            1,
            1,
            1,
            1,
            1,
            1,
            1,
            1,
            1,
            1,
            1,
            1,
            1,
            1,
            1,
            1,
            1,
            1
          ],
          "sign_concordance": [
            true,
            true,
            true,
            true,
            true,
            true,
            true,
            true,
            true,
            true,
            true,
            true,
            true,
            true,
            true,
            true,
            true,
            true
          ],
          "standard_error_ratio": [
            1.1983120780713388,
            1.0801335194339896,
            0.9998108905165703,
            1.0094145632329992,
            1.0222715899382642,
            1.0233370090698095,
            1.0570298344283378,
            1.0567410205287788,
            1.0340557594855402,
            1.0362769916811254,
            1.058120191246295,
            1.0699311757893275,
            1.0576306816843828,
            1.0129639636279943,
            1.0077329076908703,
            1.0086194531307255,
            1.0598586785140924,
            1.0715142917584306
          ]
        },
        {
          "absolute_estimate_delta": [
            0.015556207232965497,
            0.03167533400246414,
            0.017057642611462587,
            0.016198513205289977,
            0.006371253351936668,
            0.036599029896234425,
            0.008152579240113367,
            0.06709686578949192,
            0.06222062020802399,
            0.08703644684446044,
            0.0650904660589482,
            0.10563177718093364,
            0.1503419993130275,
            0.11300158495603618,
            0.06574630602386922,
            0.105625730217211,
            0.09393228824962585,
            0.0490631141689124
          ],
          "alternative_id": "ra-alt-d520ffb46adc8874ef66966e28441c52",
          "anchor_sign_changes": 0,
          "estimate_delta": [
            -0.015556207232965497,
            -0.03167533400246414,
            -0.017057642611462587,
            -0.016198513205289977,
            0.006371253351936668,
            0.036599029896234425,
            0.008152579240113367,
            -0.06709686578949192,
            -0.06222062020802399,
            -0.08703644684446044,
            -0.0650904660589482,
            -0.10563177718093364,
            -0.1503419993130275,
            -0.11300158495603618,
            -0.06574630602386922,
            -0.105625730217211,
            -0.09393228824962585,
            -0.0490631141689124
          ],
          "horizons": [
            0,
            1,
            2,
            3,
            4,
            5,
            6,
            7,
            8,
            9,
            10,
            11,
            12,
            13,
            14,
            15,
            16,
            17
          ],
          "interval_overlap": [
            true,
            true,
            true,
            true,
            true,
            true,
            true,
            true,
            true,
            true,
            true,
            true,
            true,
            true,
            true,
            true,
            true,
            true
          ],
          "max_coefficient_delta": 0.1503419993130275,
          "max_standardized_path_deviation": 0.23396375049698392,
          "nobs_delta": [
            -1,
            -1,
            -1,
            -1,
            -1,
            -1,
            -1,
            -1,
            -1,
            -1,
            -1,
            -1,
            -1,
            -1,
            -1,
            -1,
            -1,
            -1
          ],
          "sign_concordance": [
            true,
            true,
            true,
            true,
            true,
            true,
            true,
            true,
            true,
            true,
            true,
            true,
            true,
            true,
            true,
            true,
            true,
            true
          ],
          "standard_error_ratio": [
            1.1668133379093688,
            1.3029146991669391,
            1.1960907728181482,
            1.1169684593339684,
            1.118112343587039,
            1.0678392729521105,
            1.0283981298406428,
            1.0651632704545666,
            1.047097199752835,
            1.0488137572061886,
            1.0411295883075842,
            1.0199715359299046,
            1.0402470663586205,
            1.0487133952945578,
            1.1161422645835952,
            1.0879097325117602,
            1.0670531049139864,
            1.0646789853982914
          ]
        }
      ],
      "anchor_sign_changes": 0,
      "execution_records": [
        {
          "alternative_id": "ra-alt-ed5c2aa2a14eddfa516c629020579ddc",
          "check_id": "ra-check-4381c1fabc0180978aec15efc6c64e44",
          "duration_seconds": 2.224733,
          "execution_error": null,
          "issue_codes": [],
          "patch": {
            "lags": 3
          },
          "request": {
            "analysis_track": "identified_shock_irf",
            "claim_eligibility": "causal_candidate",
            "confidence_level": 0.95,
            "control_variable_ids": [
              "dlrgdp",
              "dlcpi",
              "dstir"
            ],
            "estimand_type": "impulse_response",
            "exposure_variable_id": "rr_shock",
            "frequency": "Q",
            "hac_maxlags": 17,
            "horizons": [
              0,
              1,
              2,
              3,
              4,
              5,
              6,
              7,
              8,
              9,
              10,
              11,
              12,
              13,
              14,
              15,
              16,
              17
            ],
            "lags": 3,
            "macro_data_bundle_refs": [
              "macro-result-0123456789abcdef"
            ],
            "method_profile": "observed_shock_linear_lp",
            "outcome_variable_id": "lcpi",